{
  "$schema": "https://json-schema.org/draft/2020-12/schema",
  "$id": "https://ai-development-control-center.local/schemas/project-contract-v1.json",
  "title": "ProjectContractV1",
  "description": "Machine-readable project intent and governance source of truth. Runtime parser must mirror this schema (additionalProperties:false). metadata/observedAt are audit-only and excluded from the authority fingerprint.",
  "type": "object",
  "additionalProperties": false,
  "required": [
    "schemaVersion",
    "projectId",
    "name",
    "objective",
    "problemStatement",
    "users",
    "successCriteria",
    "inScope",
    "outOfScope",
    "constraints",
    "repositories",
    "humanGatePolicy"
  ],
  "properties": {
    "schemaVersion": { "const": "PROJECT-CONTRACT-V1" },
    "projectId": {
      "type": "string",
      "minLength": 1,
      "maxLength": 128,
      "pattern": "^[a-zA-Z0-9][a-zA-Z0-9._-]{0,127}$"
    },
    "name": { "type": "string", "minLength": 1, "maxLength": 256 },
    "objective": { "type": "string", "minLength": 1, "maxLength": 4096 },
    "problemStatement": { "type": "string", "minLength": 1, "maxLength": 8192 },
    "users": {
      "description": "Actors / user roles for the project.",
      "type": "array",
      "minItems": 1,
      "maxItems": 64,
      "items": { "type": "string", "minLength": 1, "maxLength": 256 },
      "uniqueItems": true
    },
    "successCriteria": {
      "type": "array",
      "minItems": 1,
      "maxItems": 64,
      "items": { "type": "string", "minLength": 1, "maxLength": 2048 },
      "uniqueItems": true
    },
    "inScope": {
      "type": "array",
      "minItems": 1,
      "maxItems": 128,
      "items": { "type": "string", "minLength": 1, "maxLength": 2048 },
      "uniqueItems": true
    },
    "outOfScope": {
      "type": "array",
      "minItems": 1,
      "maxItems": 128,
      "items": { "type": "string", "minLength": 1, "maxLength": 2048 },
      "uniqueItems": true
    },
    "constraints": {
      "type": "object",
      "additionalProperties": false,
      "properties": {
        "maxRiskClass": {
          "enum": ["R0", "R1", "R2", "R3", "R4", "R5"]
        },
        "prohibitedCapabilities": {
          "type": "array",
          "maxItems": 64,
          "items": {
            "type": "string",
            "minLength": 1,
            "maxLength": 128,
            "pattern": "^[a-z][a-z0-9]*(?:\\.[a-z0-9]+(?:-[a-z0-9]+)*)+\\.v[0-9]+$"
          },
          "uniqueItems": true
        },
        "maxRepositories": {
          "type": "integer",
          "minimum": 1,
          "maximum": 32
        },
        "requireIndependentVerify": { "type": "boolean" },
        "notes": {
          "type": "array",
          "maxItems": 16,
          "items": { "type": "string", "minLength": 1, "maxLength": 1024 }
        }
      }
    },
    "repositories": {
      "type": "array",
      "minItems": 1,
      "maxItems": 32,
      "items": {
        "type": "object",
        "additionalProperties": false,
        "required": ["repository", "role"],
        "properties": {
          "repository": {
            "type": "string",
            "minLength": 3,
            "maxLength": 256,
            "pattern": "^[a-zA-Z0-9._-]+/[a-zA-Z0-9._-]+$"
          },
          "role": { "enum": ["PRIMARY", "SECONDARY", "OBSERVED"] },
          "defaultBranch": {
            "type": "string",
            "minLength": 1,
            "maxLength": 256,
            "pattern": "^[a-zA-Z0-9._\\/-]{1,256}$"
          }
        }
      }
    },
    "humanGatePolicy": {
      "description": "Explicit Human-gate policy as data. PROJECT-CONTRACT-V1 does not grant Ready/Merge/IssueClose/Deploy authority; runtime requires all four flags true.",
      "type": "object",
      "additionalProperties": false,
      "required": [
        "readyRequiresHuman",
        "mergeRequiresHuman",
        "issueCloseRequiresHuman",
        "deployRequiresHuman"
      ],
      "properties": {
        "readyRequiresHuman": { "type": "boolean" },
        "mergeRequiresHuman": { "type": "boolean" },
        "issueCloseRequiresHuman": { "type": "boolean" },
        "deployRequiresHuman": { "type": "boolean" }
      }
    },
    "metadata": {
      "description": "Audit / observation fields only. observedAt and other metadata MUST NOT participate in the authority fingerprint.",
      "type": "object",
      "additionalProperties": false,
      "properties": {
        "createdAt": { "type": "string", "minLength": 1, "maxLength": 64 },
        "createdBy": { "type": "string", "minLength": 1, "maxLength": 256 },
        "observedAt": { "type": "string", "minLength": 1, "maxLength": 64 },
        "sourceIssueUrl": { "type": "string", "minLength": 1, "maxLength": 2048 },
        "notes": {
          "type": "array",
          "maxItems": 16,
          "items": { "type": "string", "minLength": 1, "maxLength": 1024 }
        }
      }
    }
  }
}
